{
  "schema_version": 1,
  "review_type": "flow",
  "artifact_path": "specs/ask-survey/flows/review/flow-review-data.json",
  "confirm_strategy": "batch",
  "batch_id": "ask-survey-flow-2026-06-25",
  "project": {
    "name": "ASK",
    "feature": "问卷与文档协同",
    "business_overview": "ASK 示例把问卷、文档和租户管理放在同一轮集中审核里。审核人先看每个模块要解决什么业务问题，再处理少数必须人工决定的选择。",
    "review_goal": "确认问卷发布、文档关联和租户权限这些业务路径是否清楚，避免后续开发按错误规则推进。"
  },
  "source_snapshot": [
    {
      "path": "specs/ask-survey/prd.md",
      "anchors": [
        "问卷发布",
        "文档关联",
        "租户管理"
      ],
      "semantic_scope": [
        "业务规则",
        "审核责任",
        "开发授权"
      ]
    }
  ],
  "modules": [
    {
      "id": "survey-management",
      "title": "问卷管理",
      "summary": "处理问卷从草稿到发布、回收和关闭的业务过程。产品经理重点确认发布条件和异常处理方式。",
      "review_layer": "business",
      "must_confirm_total": 2,
      "diagrams": [
        {
          "id": "survey-draft-publish",
          "title": "问卷从草稿到发布",
          "summary": "这个流程说明运营创建问卷后，系统如何检查发布条件，并在信息不足时把问题退回给运营补齐。",
          "source_path": "specs/ask-survey/flows/survey-draft-publish.md",
          "item_type": "flowchart",
          "nodes": [
            {
              "id": "survey-draft-publish-start",
              "label": "运营创建问卷草稿",
              "plain_summary": "运营先录入问卷名称、题目和预计回收范围，草稿阶段不会影响真实用户。",
              "review_layer": "business",
              "review_level": "verified",
              "owner": "产品经理",
              "node_kind": "flow",
              "source_ref": "prd.md#问卷草稿"
            },
            {
              "id": "survey-draft-publish-edit",
              "label": "补齐题目和说明",
              "plain_summary": "题目、选项和说明要能让被调查人看懂；这一步已由 PRD 说明，通常不需要重复确认。",
              "review_layer": "business",
              "review_level": "verified",
              "owner": "产品经理",
              "node_kind": "flow",
              "source_ref": "prd.md#题目编辑"
            },
            {
              "id": "survey-draft-publish-readiness",
              "label": "确认发布前必须检查哪些内容",
              "plain_summary": "本轮需要先拍板发布前必须检查哪些内容，否则 UI、开发和验收会按猜测推进，可能导致问卷误发布。",
              "action_prompt": "请选择发布前的强制检查范围。",
              "review_layer": "business",
              "review_level": "must_confirm",
              "owner": "产品经理",
              "node_kind": "human_judgment",
              "source_ref": "prd.md#发布条件",
              "recommended_option": "OPTION_A",
              "options": [
                {
                  "id": "OPTION_A",
                  "label": "发布前同时检查题目、回收范围和截止时间",
                  "consequence": "模型后续把题目、回收范围和截止时间写入发布前拦截规则，并保留“缺什么就提示什么”的修复路径。",
                  "next_exit": "continue: 写入三项发布前强制校验",
                  "recommended": true,
                  "benefit": "发布门槛会一次说清，运营、开发和验收都能按题目、回收范围、截止时间三项检查推进，误发布风险最低。",
                  "cost": "开发范围会增加校验和提示，但统计口径、运营责任和验收标准最清楚，误发问卷的风险最低。",
                  "recommendation_reason": "推荐这条路，因为它覆盖了当前 PRD 里最容易导致误发布的三类信息，比先缩小校验范围更稳，也比拆流程更省审核和开发成本。"
                },
                {
                  "id": "OPTION_B",
                  "label": "先补产品决策，再决定发布前检查范围",
                  "consequence": "模型先生成待补问题清单，产品经理确认问卷类型、必填信息和例外情况前，不授权开发团队实现发布校验。",
                  "next_exit": "needs-decision: 补充发布前检查规则",
                  "benefit": "产品经理能先把不同问卷类型和必填门槛补清楚，后续流程、界面、开发和验收不会按猜测推进。",
                  "cost": "会延后发布流程开发，但能避免团队按错误规则实现，减少后续返工。 在产品经理补充决定前，相关流程、界面或开发任务会暂停，排期需要预留这次确认时间。"
                },
                {
                  "id": "OPTION_C",
                  "label": "只先固定题目完整性，发布范围由运营线下确认",
                  "consequence": "模型后续只把题目和选项完整性写成系统校验，并在确认文件里记录回收范围、截止时间暂由运营人工负责。",
                  "next_exit": "revise-local-and-continue: 缩小发布校验范围",
                  "benefit": "一期发布能力可以更快落地，开发先集中处理题目完整性，回收范围和截止时间由运营人工兜底。",
                  "cost": "开发速度更快，但后续容易出现发错人群或忘记关闭问卷的问题，运营培训和验收备注要写得更明确。 这种做法更快，但会把一部分风险交给运营培训、人工检查或后续补充测试。"
                },
                {
                  "id": "OPTION_D",
                  "label": "拆成内容校验和发布范围校验两个子流程",
                  "consequence": "模型后续拆出两个短流程：内容检查确认题目是否合格，投放检查确认发布对象和回收时间是否合格。",
                  "next_exit": "split-flow: 拆分发布前校验流程",
                  "benefit": "发布前责任会拆得更清楚，内容检查和投放检查各自独立，审核人更容易看懂每个子流程的入口、出口和责任人。",
                  "cost": "流程审核会更清楚，但开发和验收要多覆盖一次负责人分工，适合高风险或多角色发布场景。 审核材料、流程文件和验收点会增加，模型下一轮要分别维护这些子流程。"
                }
              ],
              "decision_background": "问卷一旦发布，填写人就能看到并提交答卷。发布前如果题目、回收范围或截止时间没检查清楚，后续统计、运营责任和用户通知都会受影响。",
              "decision_summary": "请决定发布前系统必须检查哪些内容，以及是否需要把复杂发布规则拆成更小的确认流程。"
            },
            {
              "id": "survey-draft-publish-release",
              "label": "问卷上线",
              "plain_summary": "通过检查后，问卷进入可填写状态，目标用户可以开始提交答卷。",
              "review_layer": "business",
              "review_level": "key_step",
              "owner": "产品经理",
              "node_kind": "flow",
              "source_ref": "prd.md#问卷上线"
            },
            {
              "id": "survey-draft-publish-gap",
              "label": "信息不足时退回补齐",
              "plain_summary": "本轮需要先明确发布失败时怎么提示，否则发布失败页面、开发和测试会按笼统错误处理。",
              "action_prompt": "请选择信息不足时的处理方式。",
              "review_layer": "business",
              "review_level": "must_confirm",
              "owner": "产品经理",
              "node_kind": "human_judgment",
              "source_ref": "prd.md#发布失败提示",
              "recommended_option": "OPTION_A",
              "options": [
                {
                  "id": "OPTION_A",
                  "label": "列出全部缺失项，并让运营回到对应位置补齐",
                  "consequence": "模型后续把发布失败提示写成逐项清单，并把每个缺失项连接到问卷编辑页里的对应区域。",
                  "next_exit": "continue: 生成缺失项清单和返回编辑路径",
                  "recommended": true,
                  "benefit": "运营能一次看到所有缺失项，并直接回到对应位置修改，发布失败后的反复试错和沟通成本会降低。",
                  "cost": "提示设计和测试用例会多一些，但运营不需要反复试错，发布效率和客服解释成本都会更可控。",
                  "recommendation_reason": "推荐这条路，因为运营一次看到全部缺失项后最容易修正，虽然提示和测试多一些，但比单项报错更少反复试错。"
                },
                {
                  "id": "OPTION_B",
                  "label": "先补齐失败文案和责任边界，再授权开发",
                  "consequence": "模型先生成待确认问题，产品经理明确提示文案、责任人和缺失项优先级后，再继续改发布失败流程。",
                  "next_exit": "needs-decision: 补充发布失败提示规则",
                  "benefit": "产品经理能先定清提示文案、维护责任和缺失项优先级，后续界面、开发和验收不会按笼统错误处理。",
                  "cost": "发布体验开发会后移，但能避免错误提示太含糊，减少上线后运营和研发互相解释。 在产品经理补充决定前，相关流程、界面或开发任务会暂停，排期需要预留这次确认时间。"
                },
                {
                  "id": "OPTION_C",
                  "label": "只提示最影响发布的一项，先保证流程能跑通",
                  "consequence": "模型后续只保留一个最优先错误提示，例如“缺少截止时间”或“题目为空”，并把剩余提示列入后续产品补充清单。",
                  "next_exit": "revise-local-and-continue: 先做单项缺失提示",
                  "benefit": "一期实现范围更小，团队能先拦住最严重的误发布问题，让基础发布流程尽快跑通。",
                  "cost": "实现成本较低，但运营可能需要多次修改才能成功发布，验收时要接受这个体验限制。 这种做法更快，但会把一部分风险交给运营培训、人工检查或后续补充测试。"
                },
                {
                  "id": "OPTION_D",
                  "label": "把失败处理拆成提示、补齐、再次发布三个小步骤",
                  "consequence": "模型后续拆出提示、返回编辑、再次发布三个短流程，并分别标明提示内容、返回位置和重新发布条件。",
                  "next_exit": "split-flow: 拆分发布失败处理流程",
                  "benefit": "失败处理会被拆成提示、补齐、再次发布三个短步骤，UI、测试和客服话术都能复用这些清楚的步骤。",
                  "cost": "审核材料会更细，但后续 UI、测试和客服话术都能直接复用这些步骤。 审核材料、流程文件和验收点会增加，模型下一轮要分别维护这些子流程。"
                }
              ],
              "decision_background": "发布失败不是单纯报错，运营需要知道哪里缺材料、回到哪里补、补完后能不能继续发布。这里如果没定清楚，UI 和测试会按笼统错误处理。",
              "decision_summary": "请决定信息不足时给运营怎样的提示和返回路径，避免发布失败后不知道该补什么。"
            },
            {
              "id": "survey-draft-publish-audit-log",
              "label": "系统记录发布结果",
              "plain_summary": "系统保存谁在什么时候发布或被拦截。该记录用于追踪问题，无需产品经理确认。",
              "action_prompt": "系统/架构负责人确认审计记录保存方式；无需产品确认。",
              "review_layer": "system_arch",
              "review_level": "system_arch",
              "owner": "系统架构负责人",
              "node_kind": "system",
              "source_ref": "architecture.md#审计记录"
            }
          ],
          "edges": [
            {
              "from": "survey-draft-publish-start",
              "to": "survey-draft-publish-edit",
              "label": "录入内容"
            },
            {
              "from": "survey-draft-publish-edit",
              "to": "survey-draft-publish-readiness",
              "label": "准备发布"
            },
            {
              "from": "survey-draft-publish-readiness",
              "to": "survey-draft-publish-release",
              "label": "符合条件"
            },
            {
              "from": "survey-draft-publish-readiness",
              "to": "survey-draft-publish-gap",
              "label": "信息不足"
            },
            {
              "from": "survey-draft-publish-release",
              "to": "survey-draft-publish-audit-log",
              "label": "记录结果"
            },
            {
              "from": "survey-draft-publish-gap",
              "to": "survey-draft-publish-edit",
              "label": "补齐后重试"
            }
          ],
          "trace_notes": [
            "此示例把必须人工决定的点控制在两个，便于集中审核。"
          ]
        },
        {
          "id": "survey-response-close",
          "title": "问卷回收和关闭",
          "summary": "这个流程说明问卷发布后如何接收答卷，并在到期或人工关闭后停止继续回收。",
          "source_path": "specs/ask-survey/flows/survey-response-close.md",
          "item_type": "flowchart",
          "nodes": [
            {
              "id": "survey-response-open",
              "label": "用户提交答卷",
              "plain_summary": "问卷处于开放状态时，目标用户可以填写并提交答卷。",
              "review_layer": "business",
              "review_level": "verified",
              "owner": "产品经理",
              "node_kind": "flow",
              "source_ref": "prd.md#答卷提交"
            },
            {
              "id": "survey-response-duplicate",
              "label": "重复提交怎么处理",
              "plain_summary": "现在需要先定重复提交规则，否则统计口径、开发实现和测试样例都会按猜测推进。",
              "action_prompt": "请选择重复提交的业务规则。",